{
	"ValueId": 262001,
	"IndependentValue": null,
	"IndependentValueNumber": null,
	"IndependentValueDate": null,
	"IndependentValueTimestamp": null,
	"Value": "MgTEST003|CONT003|40009|029|100|999",
	"ValueNumber": null,
	"ValueDate": null,
	"ValueTimestamp": null,
	"TranslatedValue": null,
	"Description": "TEST003_NAME|CONT003_NAME",
	"EnabledFlag": "N",
	"StartDateActive": "2018-01-01",
	"EndDateActive": null,
	"SortOrder": null,
	"SummaryFlag": "N",
	"DetailPostingAllowed": "N",
	"DetailBudgetingAllowed": "N",
	"AccountType": null,
	"ControlAccount": null,
	"ReconciliationFlag": null,
	"FinancialCategory": null,
	"ExternalDataSource": null,
	"CreationDate": "2021-02-17T14:23:32+00:00",
	"CreatedBy": "SIS_INTEGRATION",
	"LastUpdateDate": "2021-02-17T14:23:33.041+00:00",
	"LastUpdatedBy": "SIS_INTEGRATION",
	"links": [
		{
			"rel": "self",
			"href": "https://fa-epnz-test-saasfaprod1.fa.ocs.oraclecloud.com:443/fscmRestApi/resources/11.13.18.05/valueSets/SIS_CUSTOMER_MAPPING/child/values/262001",
			"name": "values",
			"kind": "item"
		},
		{
			"rel": "canonical",
			"href": "https://fa-epnz-test-saasfaprod1.fa.ocs.oraclecloud.com:443/fscmRestApi/resources/11.13.18.05/valueSets/SIS_CUSTOMER_MAPPING/child/values/262001",
			"name": "values",
			"kind": "item"
		},
		{
			"rel": "parent",
			"href": "https://fa-epnz-test-saasfaprod1.fa.ocs.oraclecloud.com:443/fscmRestApi/resources/11.13.18.05/valueSets/SIS_CUSTOMER_MAPPING",
			"name": "valueSets",
			"kind": "item"
		},
		{
			"rel": "child",
			"href": "https://fa-epnz-test-saasfaprod1.fa.ocs.oraclecloud.com:443/fscmRestApi/resources/11.13.18.05/valueSets/SIS_CUSTOMER_MAPPING/child/values/262001/child/valuesDFF",
			"name": "valuesDFF",
			"kind": "collection"
		}
	]
}