{
	"ValueId": 107001,
	"IndependentValue": null,
	"IndependentValueNumber": null,
	"IndependentValueDate": null,
	"IndependentValueTimestamp": null,
	"Value": "99910",
	"ValueNumber": null,
	"ValueDate": null,
	"ValueTimestamp": null,
	"TranslatedValue": null,
	"Description": "COGNIZANT TECHNOLOGY SOLUTIONS INDIA PVT LTD1",
	"EnabledFlag": "Y",
	"StartDateActive": "2020-01-01",
	"EndDateActive": null,
	"SortOrder": null,
	"SummaryFlag": "Y",
	"DetailPostingAllowed": "N",
	"DetailBudgetingAllowed": "N",
	"AccountType": null,
	"ControlAccount": null,
	"ReconciliationFlag": null,
	"FinancialCategory": null,
	"ExternalDataSource": null,
	"CreationDate": "2020-12-18T06:29:53+00:00",
	"CreatedBy": "SIS_INTEGRATION",
	"LastUpdateDate": "2020-12-18T06:30:03.489+00:00",
	"LastUpdatedBy": "SIS_INTEGRATION",
	"links": [
		{
			"rel": "self",
			"href": "https://fa-epnz-dev1-saasfaprod1.fa.ocs.oraclecloud.com:443/fscmRestApi/resources/11.13.18.05/valueSets/Customer%20Site%20SIS_COA/child/values/107001",
			"name": "values",
			"kind": "item"
		},
		{
			"rel": "canonical",
			"href": "https://fa-epnz-dev1-saasfaprod1.fa.ocs.oraclecloud.com:443/fscmRestApi/resources/11.13.18.05/valueSets/Customer%20Site%20SIS_COA/child/values/107001",
			"name": "values",
			"kind": "item"
		},
		{
			"rel": "parent",
			"href": "https://fa-epnz-dev1-saasfaprod1.fa.ocs.oraclecloud.com:443/fscmRestApi/resources/11.13.18.05/valueSets/Customer%20Site%20SIS_COA",
			"name": "valueSets",
			"kind": "item"
		},
		{
			"rel": "child",
			"href": "https://fa-epnz-dev1-saasfaprod1.fa.ocs.oraclecloud.com:443/fscmRestApi/resources/11.13.18.05/valueSets/Customer%20Site%20SIS_COA/child/values/107001/child/valuesDFF",
			"name": "valuesDFF",
			"kind": "collection"
		}
	]
}